direccion,precio,gastos_comunes,caracteristicas,num_caracteristicas,fecha_descarga,fecha_publicacion,titulo,url
"Hipódromo Chile 1608, Plaza Chacabuco, Independencia, RM (Metropolitana)",298.000,Gastos comunes aproximados $ 55.000,42 m² totales / 1 dormitorio / 1 baño,3,2023-06-12,Publicado hace 40 días por Assetplan Chile,Edificio Hipódromo Chile Vista Norte Piso 10,https://www.portalinmobiliario.com/MLC-1610730912-edificio-hipodromo-chile-vista-norte-piso-10-_JM#position=20&search_layout=stack&type=item&tracking_id=3622d116-9592-4cea-9ca8-e0baaedce22f
"Conde Del Maule 4642, Metro Ecuador, Estación Central, RM (Metropolitana)",300.000,Gastos comunes aproximados $ 40.000,27 m² totales / 1 dormitorio / 1 baño,3,2023-06-12,Publicado hace 19 días por Assetplan Chile,Edificio Conde Del Maule (1 Bod.) Piso 18,https://www.portalinmobiliario.com/MLC-1386929433-edificio-conde-del-maule-1-bod-piso-18-_JM#position=21&search_layout=stack&type=item&tracking_id=3622d116-9592-4cea-9ca8-e0baaedce22f
"Carmen 433, Santiago, Chile, Santa Isabel, Santiago, RM (Metropolitana)",290.000,Gastos comunes aproximados $ 60.000,37 m² totales / 1 dormitorio / 1 baño,3,2023-06-12,Publicado hace 52 días,Depto. 1 Dormitorio  Carmen Con Santa Isabel,https://www.portalinmobiliario.com/MLC-1391682917-depto-1-dormitorio-carmen-con-santa-isabel-_JM#position=22&search_layout=stack&type=item&tracking_id=3622d116-9592-4cea-9ca8-e0baaedce22f
"San Martín 733, Santiago, Chile, Centro Histórico de Santiago, Santiago, RM (Metropolitana)",300.000,Gastos comunes aproximados $ 40.000,34.5 m² totales / 1 dormitorio / 1 baño,3,2023-06-12,Publicado hace 3 meses,San Martin / Av. San Pablo,https://www.portalinmobiliario.com/MLC-1730728100-san-martin-av-san-pablo-_JM#position=23&search_layout=stack&type=item&tracking_id=3622d116-9592-4cea-9ca8-e0baaedce22f
"Blanco Garcés 154, Santiago, Estación Central, Chile, San Alberto Hurtado, Estación Central, RM (Metropolitana)",290.000,Gastos comunes aproximados $ 47.000,36 m² totales / 1 dormitorio / 1 baño,3,2023-06-12,Publicado hace 9 días,Arriendo Departamento Metro Ecuador,https://www.portalinmobiliario.com/MLC-1719142540-arriendo-departamento-metro-ecuador-_JM#position=24&search_layout=stack&type=item&tracking_id=3622d116-9592-4cea-9ca8-e0baaedce22f
"San Francisco 294, Bulnes, Santiago, RM (Metropolitana)",285.000,Gastos comunes aproximados $ 60.000,1 dormitorio / 1 baño,2,2023-06-12,Publicado hace 38 días por Assetplan Chile,Edificio San Francisco Piso 25,https://www.portalinmobiliario.com/MLC-1620949654-edificio-san-francisco-piso-25-_JM#position=25&search_layout=stack&type=item&tracking_id=3622d116-9592-4cea-9ca8-e0baaedce22f
"Padre Alberto Hurtado 59 Estación Central, San Alberto Hurtado, Estación Central, RM (Metropolitana)",290.000,Gastos comunes aproximados $ 40.000,38 m² totales / 1 dormitorio / 1 baño,3,2023-06-12,Publicado hace 35 días por Unne,Metro Alberto Hurtado/ 1 Dorm. En Estación Central,https://www.portalinmobiliario.com/MLC-1381595225-metro-alberto-hurtado-1-dorm-en-estacion-central-_JM#position=26&search_layout=stack&type=item&tracking_id=3622d116-9592-4cea-9ca8-e0baaedce22f
"El Molino 1787, Juan Antonio Ríos, Independencia, RM (Metropolitana)",290.000,Gastos comunes aproximados $ 45.000,1 dormitorio / 1 baño,2,2023-06-12,Publicado hace 9 días por Assetplan Chile,Edificio El Molino Piso 16,https://www.portalinmobiliario.com/MLC-1719155720-edificio-el-molino-piso-16-_JM#position=27&search_layout=stack&type=item&tracking_id=3622d116-9592-4cea-9ca8-e0baaedce22f
"Tarapaca 1331, Bulnes, Santiago, RM (Metropolitana)",300.000,Gastos comunes aproximados $ 135.000,30 m² totales / 1 dormitorio / 1 baño,3,2023-06-12,Publicado hace 9 días por Assetplan Chile,Edificio Tarapaca Vista Norte Piso 29,https://www.portalinmobiliario.com/MLC-1390709507-edificio-tarapaca-vista-norte-piso-29-_JM#position=28&search_layout=stack&type=item&tracking_id=3622d116-9592-4cea-9ca8-e0baaedce22f
"Lo Ovalle, La Cisterna, RM (Metropolitana)",295.000,,30 m² totales / 1 dormitorio / 1 baño,3,2023-06-12,Publicado hace 11 días por Property Partners,Oportunidad Excelente Departamento,https://www.portalinmobiliario.com/MLC-1390214397-oportunidad-excelente-departamento-_JM#position=29&search_layout=stack&type=item&tracking_id=3622d116-9592-4cea-9ca8-e0baaedce22f
"Metro Ecuador, San Alberto Hurtado, Estación Central, RM (Metropolitana)",290.000,,32 m² totales,1,2023-06-12,Publicado hace 17 días por Gestion&propiedad,Metro Ecuador,https://www.portalinmobiliario.com/MLC-1702187656-metro-ecuador-_JM#position=30&search_layout=stack&type=item&tracking_id=3622d116-9592-4cea-9ca8-e0baaedce22f
"Sta Isabel 951, San Diego, Santiago, RM (Metropolitana)",285.000,Gastos comunes aproximados $ 55.000,27 m² totales / 1 dormitorio / 1 baño,3,2023-06-12,Publicado hace 38 días por Assetplan Chile,Edificio Sta Isabel Vista Norte Piso 15,https://www.portalinmobiliario.com/MLC-1620877990-edificio-sta-isabel-vista-norte-piso-15-_JM#position=31&search_layout=stack&type=item&tracking_id=3622d116-9592-4cea-9ca8-e0baaedce22f
"San Isidro 550, Santiago, Chile, Santa Isabel, Santiago, RM (Metropolitana)",300.000,Gastos comunes aproximados $ 51.000,39 m² totales / 1 dormitorio / 1 baño,3,2023-06-12,Publicado hace 20 días,Lindo Departamento 1 Dor 1 Baño Vista Despejada,https://www.portalinmobiliario.com/MLC-1386816505-lindo-departamento-1-dor-1-bano-vista-despejada-_JM#position=32&search_layout=stack&type=item&tracking_id=3622d116-9592-4cea-9ca8-e0baaedce22f
"Santo Domingo 1364, Santiago, Chile, Centro Histórico de Santiago, Santiago, RM (Metropolitana)",290.000,Gastos comunes aproximados $ 55.000,34 m² totales / 1 dormitorio / 1 baño,3,2023-06-12,Publicado hace 4 meses,"Lindo Depto. 1 Dormitorio, Santo Domingo, Metro Santa Ana",https://www.portalinmobiliario.com/MLC-1392388817-lindo-depto-1-dormitorio-santo-domingo-metro-santa-ana-_JM#position=33&search_layout=stack&type=item&tracking_id=3622d116-9592-4cea-9ca8-e0baaedce22f
"Santa Rosa, El Llano, San Miguel, RM (Metropolitana)",300.000,Gastos comunes aproximados $ 30.000,24 m² totales / 1 dormitorio / 1 baño,3,2023-06-12,Publicado hace 12 días,Departamento En Arriendo De 1 Dorm. En San Miguel,https://www.portalinmobiliario.com/MLC-1713911564-departamento-en-arriendo-de-1-dorm-en-san-miguel-_JM#position=34&search_layout=stack&type=item&tracking_id=3622d116-9592-4cea-9ca8-e0baaedce22f
"Metro Matta, Parque O'Higgins, Santiago, RM (Metropolitana)",300.000,Gastos comunes aproximados $ 65.000,30 m² totales / 1 dormitorio / 1 baño,3,2023-06-12,Publicado hace 11 días por Gestion&propiedad,Metro Matta,https://www.portalinmobiliario.com/MLC-1390408107-metro-matta-_JM#position=35&search_layout=stack&type=item&tracking_id=3622d116-9592-4cea-9ca8-e0baaedce22f
"Departamento En Arriendo 1 Dormitorio Y 1 Baño. Calle Carmen Mena 838. Comuna De San Miguel., Ciudad del Niño, San Miguel, RM (Metropolitana)",300.000,Gastos comunes aproximados $ 55.000,32.43 m² totales / 1 dormitorio / 1 baño,3,2023-06-12,Publicado hace 11 días,Departamento En Arriendo De 1 D Y 1 B. Comuna De San Miguel.,https://www.portalinmobiliario.com/MLC-1390132427-departamento-en-arriendo-de-1-d-y-1-b-comuna-de-san-miguel-_JM#position=36&search_layout=stack&type=item&tracking_id=3622d116-9592-4cea-9ca8-e0baaedce22f
"Padre Alberto Hurtado 59 Estación Central, San Alberto Hurtado, Estación Central, RM (Metropolitana)",290.000,Gastos comunes aproximados $ 40.000,38 m² totales / 1 dormitorio / 1 baño,3,2023-06-12,Publicado hace 7 días por Unne,Departamento En Arriendo En Estación Central,https://www.portalinmobiliario.com/MLC-1391220549-departamento-en-arriendo-en-estacion-central-_JM#position=37&search_layout=stack&type=item&tracking_id=3622d116-9592-4cea-9ca8-e0baaedce22f
"Metro San Alberto Hurtado, San Alberto Hurtado, Estación Central, RM (Metropolitana)",301.000,Gastos comunes aproximados $ 60.000,32 m² totales / 1 dormitorio / 1 baño,3,2023-06-12,Publicado hace 10 días por Gestion&propiedad,Metro San Alberto Hurtado,https://www.portalinmobiliario.com/MLC-1719134280-metro-san-alberto-hurtado-_JM#position=38&search_layout=stack&type=item&tracking_id=3622d116-9592-4cea-9ca8-e0baaedce22f
"Recreo, 250, San Alberto Hurtado, Estación Central, RM (Metropolitana)",290.000,Gastos comunes aproximados $ 30.000,34 m² totales / 1 dormitorio / 1 baño,3,2023-06-12,Publicado hace 18 días por Re/max 360,Comodidad Y Conveniencia: Depa De 1 Dormitorio!,https://www.portalinmobiliario.com/MLC-1699129050-comodidad-y-conveniencia-depa-de-1-dormitorio-_JM#position=39&search_layout=stack&type=item&tracking_id=3622d116-9592-4cea-9ca8-e0baaedce22f
"Padre Alonso De Ovalle 884, Santiago, Chile, Bulnes, Santiago, RM (Metropolitana)",290.000,Gastos comunes aproximados $ 75.000,37 m² totales / 1 dormitorio / 1 baño,3,2023-06-12,Publicado hace 18 días,"Departamento Amoblado, Un Dormitorio, Padre Alonso Ovalle",https://www.portalinmobiliario.com/MLC-1387320951-departamento-amoblado-un-dormitorio-padre-alonso-ovalle-_JM#position=40&search_layout=stack&type=item&tracking_id=3622d116-9592-4cea-9ca8-e0baaedce22f
"Eleuterio Ramírez 600 - 900, Santiago, Región Metropolitana, Chile, San Diego, Santiago, RM (Metropolitana)",290.000,Gastos comunes aproximados $ 45.000,36 m² totales / 1 dormitorio / 1 baño,3,2023-06-12,Publicado hace 20 días,Excelente Departamento En Arriendo En Santiago,https://www.portalinmobiliario.com/MLC-1386838201-excelente-departamento-en-arriendo-en-santiago-_JM#position=41&search_layout=stack&type=item&tracking_id=3622d116-9592-4cea-9ca8-e0baaedce22f
"Av Departamental, 915, Ciudad del Niño, San Miguel, RM (Metropolitana)",295.000,,35 m² totales / 1 dormitorio / 1 baño,3,2023-06-12,Publicado hace 6 meses,3 Departamentos En Arriendo De Excelente Estado ,https://www.portalinmobiliario.com/MLC-1382427437-3-departamentos-en-arriendo-de-excelente-estado-_JM#position=42&search_layout=stack&type=item&tracking_id=3622d116-9592-4cea-9ca8-e0baaedce22f
"Chacabuco 1120, Santiago, Chile, Parque Los Reyes, Santiago, RM (Metropolitana)",290.000,Gastos comunes aproximados $ 35.000,35 m² totales / 1 dormitorio / 1 baño,3,2023-06-12,Publicado hace 2 meses,Nuevo A Estrenar - Chacabuco - Mapocho,https://www.portalinmobiliario.com/MLC-1386626721-nuevo-a-estrenar-chacabuco-mapocho-_JM#position=43&search_layout=stack&type=item&tracking_id=3622d116-9592-4cea-9ca8-e0baaedce22f
"Manuel Antonio Tocornal 601, Santa Isabel, Santiago, RM (Metropolitana)",300.000,Gastos comunes aproximados $ 45.000,28.6 m² totales / 1 dormitorio / 1 baño,3,2023-06-12,Publicado hace 12 días por Assetplan Chile,Edificio Manuel Antonio Tocornal Vista Poniente Piso 7,https://www.portalinmobiliario.com/MLC-1390079351-edificio-manuel-antonio-tocornal-vista-poniente-piso-7-_JM#position=44&search_layout=stack&type=item&tracking_id=3622d116-9592-4cea-9ca8-e0baaedce22f
"Moneda 1541/ San Martin, Centro Histórico de Santiago, Santiago, RM (Metropolitana)",8,Gastos comunes aproximados $ 60.000,38 m² totales / 1 dormitorio / 1 baño,3,2023-06-12,Publicado hace 14 días,Moneda 1541/ San Martin ,https://www.portalinmobiliario.com/MLC-1707657122-moneda-1541-san-martin-_JM#position=45&search_layout=stack&type=item&tracking_id=3622d116-9592-4cea-9ca8-e0baaedce22f
"Vargas Buston 770, Ciudad del Niño, San Miguel, RM (Metropolitana)",300.000,,35 m² totales / 1 dormitorio / 1 baño,3,2023-06-12,Publicado hace 30 días por Capitalizarme Rent,Ref:13643**     Hermoso Depto Cercano Al Metro Ciudad Del Ni,https://www.portalinmobiliario.com/MLC-1383961959-ref13643-hermoso-depto-cercano-al-metro-ciudad-del-ni-_JM#position=46&search_layout=stack&type=item&tracking_id=3622d116-9592-4cea-9ca8-e0baaedce22f
"Tercera Avenida, Ciudad del Niño, San Miguel, RM (Metropolitana)",285.000,Gastos comunes aproximados $ 35.000,38 m² totales / 1 dormitorio / 1 baño,3,2023-06-12,Publicado hace 12 días por Houm,Departamento Tercera Avenida Id: 40401,https://www.portalinmobiliario.com/MLC-1389824817-departamento-tercera-avenida-id-40401-_JM#position=47&search_layout=stack&type=item&tracking_id=3622d116-9592-4cea-9ca8-e0baaedce22f
"Blanco Garcés 154, Santiago, Estación Central, Chile, San Alberto Hurtado, Estación Central, RM (Metropolitana)",300.000,Gastos comunes aproximados $ 45.000,31 m² totales / 1 dormitorio / 1 baño,3,2023-06-12,Publicado hace 27 días,Increíble Vista Despejada A La Cordillera,https://www.portalinmobiliario.com/MLC-1670434154-increible-vista-despejada-a-la-cordillera-_JM#position=48&search_layout=stack&type=item&tracking_id=3622d116-9592-4cea-9ca8-e0baaedce22f
"Avenida José Joaquín Prieto 4260, San Miguel, Chile, Lo Vial, San Miguel, RM (Metropolitana)",290.000,Gastos comunes aproximados $ 55.000,33 m² totales / 1 dormitorio / 1 baño,3,2023-06-12,Publicado hace 28 días,"Precioso Departamento En Salesianos, San Miguel",https://www.portalinmobiliario.com/MLC-1669865670-precioso-departamento-en-salesianos-san-miguel-_JM#position=49&search_layout=stack&type=item&tracking_id=3622d116-9592-4cea-9ca8-e0baaedce22f
"Cuarta Avenida 1175, Ciudad del Niño, San Miguel, RM (Metropolitana)",295.000,Gastos comunes aproximados $ 60.000,35.98 m² totales / 1 dormitorio / 1 baño,3,2023-06-12,Publicado hace 8 días por Assetplan Chile,Edificio Cuarta Avenida Vista Oriente Piso 16,https://www.portalinmobiliario.com/MLC-1390947509-edificio-cuarta-avenida-vista-oriente-piso-16-_JM#position=50&search_layout=stack&type=item&tracking_id=3622d116-9592-4cea-9ca8-e0baaedce22f
"Nuevo / Metro Ciudad Del Niño/ Spacio Urbano, Ciudad del Niño, San Miguel, RM (Metropolitana)",290.000,Gastos comunes aproximados $ 40.000,30 m² totales / 1 dormitorio / 1 baño,3,2023-06-12,Publicado hace 20 días por Nieny,Departamento Nuevo/ Metro Ciudad Del Niño,https://www.portalinmobiliario.com/MLC-1386821953-departamento-nuevo-metro-ciudad-del-nino-_JM#position=1&search_layout=stack&type=item&tracking_id=584d6245-eba0-4253-ba57-33c77442d181
"Carvajal 0330, Lo Ovalle, La Cisterna, RM (Metropolitana)",290.000,,40.31 m² totales / 1 dormitorio / 1 baño,3,2023-06-12,Publicado hace 30 días por Capitalizarme Rent,Ref:11127**   Estrena Dpto 1d 1b M. Lo Ovalle,https://www.portalinmobiliario.com/MLC-1663518994-ref11127-estrena-dpto-1d-1b-m-lo-ovalle-_JM#position=2&search_layout=stack&type=item&tracking_id=584d6245-eba0-4253-ba57-33c77442d181
"San Isidro/santa Isabel, Santa Isabel, Santiago, RM (Metropolitana)",290.000,Gastos comunes aproximados $ 100.000,43 m² totales / 1 dormitorio / 1 baño,3,2023-06-12,Publicado hace 18 días por Procasa,Departamento San Isidro/santa Isabel,https://www.portalinmobiliario.com/MLC-1697898246-departamento-san-isidrosanta-isabel-_JM#position=3&search_layout=stack&type=item&tracking_id=584d6245-eba0-4253-ba57-33c77442d181
"Barrio República - Amoblado, Ejército - Toesca, Santiago, RM (Metropolitana)",300.000,Gastos comunes aproximados $ 45.000,38 m² totales / 1 dormitorio / 1 baño,3,2023-06-12,Publicado hace 8 días,Departamento En Arriendo De 1 Dorm. En Santiago,https://www.portalinmobiliario.com/MLC-1390885725-departamento-en-arriendo-de-1-dorm-en-santiago-_JM#position=4&search_layout=stack&type=item&tracking_id=584d6245-eba0-4253-ba57-33c77442d181
"Av. España 397, Santiago, Chile, Barrio República, Santiago, RM (Metropolitana)",299.900,Gastos comunes aproximados $ 55.000,35 m² totales / 1 dormitorio / 1 baño,3,2023-06-12,Publicado hace 54 días,Av. España / Gorbea,https://www.portalinmobiliario.com/MLC-1389478335-av-espana-gorbea-_JM#position=5&search_layout=stack&type=item&tracking_id=584d6245-eba0-4253-ba57-33c77442d181
"San Ignacio De Loyola 4250, Lo Vial, San Miguel, RM (Metropolitana)",300.000,,32 m² totales / 1 dormitorio / 1 baño,3,2023-06-12,Publicado hace 14 días,San Ignacio De Loyola 4250,https://www.portalinmobiliario.com/MLC-1389401275-san-ignacio-de-loyola-4250-_JM#position=6&search_layout=stack&type=item&tracking_id=584d6245-eba0-4253-ba57-33c77442d181
"Lira 300 - 600, Santiago, Chile, Santa Isabel, Santiago, RM (Metropolitana)",290.000,Gastos comunes aproximados $ 70.000,28 m² totales / 1 dormitorio / 1 baño,3,2023-06-12,Publicado hace 24 días,Excelente Departamento Cercano A Metro Santa Isabel.,https://www.portalinmobiliario.com/MLC-1385419861-excelente-departamento-cercano-a-metro-santa-isabel-_JM#position=7&search_layout=stack&type=item&tracking_id=584d6245-eba0-4253-ba57-33c77442d181
"Av Independencia Con Leonor Cepeda Esquina Carrion, Hospitales, Independencia, RM (Metropolitana)",290.000,Gastos comunes aproximados $ 32.000,78 m² totales / 1 dormitorio / 1 baño,3,2023-06-12,Publicado hace 34 días,Departamento En Arriendo De 1 Dorm. En Independencia,https://www.portalinmobiliario.com/MLC-1382473375-departamento-en-arriendo-de-1-dorm-en-independencia-_JM#position=8&search_layout=stack&type=item&tracking_id=584d6245-eba0-4253-ba57-33c77442d181
"Eluterio Ramírez / Av. Santa Rosa, San Diego, Santiago, RM (Metropolitana)",298.000,Gastos comunes aproximados $ 33.000,36 m² totales / 1 dormitorio / 1 baño,3,2023-06-12,Publicado hace 34 días,Departamento En Arriendo De 1 Dorm. En Santiago,https://www.portalinmobiliario.com/MLC-1640262616-departamento-en-arriendo-de-1-dorm-en-santiago-_JM#position=9&search_layout=stack&type=item&tracking_id=584d6245-eba0-4253-ba57-33c77442d181
"San Isidro 151, Santiago, Chile, Santa Isabel, Santiago, RM (Metropolitana)",290.000,Gastos comunes aproximados $ 45.000,36 m² totales / 1 dormitorio / 1 baño,3,2023-06-12,Publicado hace 10 días,Metro Santa Lucía,https://www.portalinmobiliario.com/MLC-1717979576-metro-santa-lucia-_JM#position=10&search_layout=stack&type=item&tracking_id=584d6245-eba0-4253-ba57-33c77442d181
"Metro Santa Ana, Barrio Brasil, Santiago, RM (Metropolitana)",300.000,Gastos comunes aproximados $ 60.000,26 m² totales / 1 dormitorio / 1 baño,3,2023-06-12,Publicado hace 11 días,Departamento En Arriendo En Santiago,https://www.portalinmobiliario.com/MLC-1717914910-departamento-en-arriendo-en-santiago-_JM#position=11&search_layout=stack&type=item&tracking_id=584d6245-eba0-4253-ba57-33c77442d181
"Av Independencia Con Leonor Cepeda Esquina Carrion, Hospitales, Independencia, RM (Metropolitana)",290.000,Gastos comunes aproximados $ 42.000,67 m² totales / 1 dormitorio / 1 baño,3,2023-06-12,Publicado hace 27 días,Arriendo Departamento Metro Hospitales Independencia 1d1b,https://www.portalinmobiliario.com/MLC-1673838842-arriendo-departamento-metro-hospitales-independencia-1d1b-_JM#position=12&search_layout=stack&type=item&tracking_id=584d6245-eba0-4253-ba57-33c77442d181
"Metro Santa Anta, Barrio Brasil, Santiago, RM (Metropolitana)",300.000,,26 m² totales / 1 baño,2,2023-06-12,Publicado hace 7 días,En Arriendo Depto 1d 1b. Frente Metro Santa Ana.excelente Ub,https://www.portalinmobiliario.com/MLC-1721240348-en-arriendo-depto-1d-1b-frente-metro-santa-anaexcelente-ub-_JM#position=13&search_layout=stack&type=item&tracking_id=584d6245-eba0-4253-ba57-33c77442d181
"Miraflores 300 - 600, Santiago, Chile, Centro Histórico de Santiago, Santiago, RM (Metropolitana)",290.000,Gastos comunes aproximados $ 32.000,30 m² totales / 1 dormitorio / 1 baño,3,2023-06-12,Publicado hace 18 días,Depto 1 Amb Cocina Equipada 30mts2 En Stgo Centro,https://www.portalinmobiliario.com/MLC-1387540729-depto-1-amb-cocina-equipada-30mts2-en-stgo-centro-_JM#position=14&search_layout=stack&type=item&tracking_id=584d6245-eba0-4253-ba57-33c77442d181
"Avenida Portugal 442, Santa Isabel, Santiago, RM (Metropolitana)",285.000,Gastos comunes aproximados $ 45.000,38 m² totales / 1 dormitorio / 1 baño,3,2023-06-12,Publicado hace 24 días,Departamento Metro Santa Isabel,https://www.portalinmobiliario.com/MLC-1385499489-departamento-metro-santa-isabel-_JM#position=15&search_layout=stack&type=item&tracking_id=584d6245-eba0-4253-ba57-33c77442d181
"San Diego 1344, Santiago, Chile, Parque O'Higgins, Santiago, RM (Metropolitana)",300.000,Gastos comunes aproximados $ 70.000,48 m² totales / 2 dormitorios / 1 baño,3,2023-06-12,Publicado hace 32 días,Arriendo Hermoso Dep 2 Dor 1 B Estac Y Bod A Pasos Av. Matta,https://www.portalinmobiliario.com/MLC-1649959112-arriendo-hermoso-dep-2-dor-1-b-estac-y-bod-a-pasos-av-matta-_JM#position=16&search_layout=stack&type=item&tracking_id=584d6245-eba0-4253-ba57-33c77442d181
"Carvajal 0330, Lo Ovalle, La Cisterna, RM (Metropolitana)",290.000,,40.3 m² totales / 1 dormitorio / 1 baño,3,2023-06-12,Publicado hace 7 días por Capitalizarme Rent,Ref:11063**      Estrena Dpto 1d 1b M. Lo Ovalle,https://www.portalinmobiliario.com/MLC-1721289994-ref11063-estrena-dpto-1d-1b-m-lo-ovalle-_JM#position=17&search_layout=stack&type=item&tracking_id=584d6245-eba0-4253-ba57-33c77442d181
"Coronel Souper 4158, San Alberto Hurtado, Estación Central, RM (Metropolitana)",300.000,Gastos comunes aproximados $ 40.000,42.5 m² totales / 1 dormitorio / 1 baño,3,2023-06-12,Publicado hace 27 días por Assetplan Chile,Edificio Coronel Souper Vista Sur Piso 6,https://www.portalinmobiliario.com/MLC-1674441696-edificio-coronel-souper-vista-sur-piso-6-_JM#position=18&search_layout=stack&type=item&tracking_id=584d6245-eba0-4253-ba57-33c77442d181
"Lira 140, Santiago, Chile, Santa Isabel, Santiago, RM (Metropolitana)",285.000,Gastos comunes aproximados $ 65.000,30 m² totales / 1 dormitorio / 1 baño,3,2023-06-12,Publicado hace 3 meses,Un Dormitorio A Pasos Hospital Uc Y Posta Central,https://www.portalinmobiliario.com/MLC-1389741249-un-dormitorio-a-pasos-hospital-uc-y-posta-central-_JM#position=19&search_layout=stack&type=item&tracking_id=584d6245-eba0-4253-ba57-33c77442d181
"Cueto 1200 - 1500, Santiago, Chile, Parque Los Reyes, Santiago, RM (Metropolitana)",300.000,Gastos comunes aproximados $ 40.000,55 m² totales / 1 dormitorio / 1 baño,3,2023-06-12,Publicado hace 14 días,Mapocho Con Cueto,https://www.portalinmobiliario.com/MLC-1389347165-mapocho-con-cueto-_JM#position=20&search_layout=stack&type=item&tracking_id=584d6245-eba0-4253-ba57-33c77442d181
"Quinta Avenida, Ciudad del Niño, San Miguel, RM (Metropolitana)",300.000,Gastos comunes aproximados $ 60.000,34 m² totales / 1 dormitorio / 1 baño,3,2023-06-12,Publicado hace 32 días por Houm,Departamento Quinta Avenida Id: 22442,https://www.portalinmobiliario.com/MLC-1652733754-departamento-quinta-avenida-id-22442-_JM#position=21&search_layout=stack&type=item&tracking_id=584d6245-eba0-4253-ba57-33c77442d181
"Moneda 720, Santiago, Chile, Centro Histórico de Santiago, Santiago, RM (Metropolitana)",300.000,Gastos comunes aproximados $ 38.000,36 m² totales / 1 dormitorio / 1 baño,3,2023-06-12,Publicado hace 21 días,Metro Santa Lucia / Moneda ,https://www.portalinmobiliario.com/MLC-1689490050-metro-santa-lucia-moneda-_JM#position=22&search_layout=stack&type=item&tracking_id=584d6245-eba0-4253-ba57-33c77442d181
"Avenida María 6415, Lo Ovalle, La Cisterna, RM (Metropolitana)",300.000,Gastos comunes aproximados $ 55.000,1 dormitorio / 1 baño,2,2023-06-12,Publicado hace 12 días por Knockit,"Avenida María 6415 , 1d1b, La Cisterna ",https://www.portalinmobiliario.com/MLC-1389760771-avenida-maria-6415-1d1b-la-cisterna-_JM#position=23&search_layout=stack&type=item&tracking_id=584d6245-eba0-4253-ba57-33c77442d181
"Blanco Garcés 154, San Alberto Hurtado, Estación Central, RM (Metropolitana)",295.000,Gastos comunes aproximados $ 165.000,29 m² totales / 1 dormitorio / 1 baño,3,2023-06-12,Publicado hace 21 días por Assetplan Chile,Edificio Blanco Garcés Vista Oriente Piso 37,https://www.portalinmobiliario.com/MLC-1386586079-edificio-blanco-garces-vista-oriente-piso-37-_JM#position=24&search_layout=stack&type=item&tracking_id=584d6245-eba0-4253-ba57-33c77442d181
"San Martín 898, Santiago, Chile, Centro Histórico de Santiago, Santiago, RM (Metropolitana)",300.000,Gastos comunes aproximados $ 65.000,35 m² totales / 1 dormitorio / 1 baño,3,2023-06-12,Publicado hace 6 meses,Céntrico / Metro Santa Ana / Bodega,https://www.portalinmobiliario.com/MLC-1390608835-centrico-metro-santa-ana-bodega-_JM#position=25&search_layout=stack&type=item&tracking_id=584d6245-eba0-4253-ba57-33c77442d181
"Mapocho 1522, Centro Histórico de Santiago, Santiago, RM (Metropolitana)",305.000,Gastos comunes aproximados $ 30.000,20 m² totales / 1 dormitorio / 1 baño,3,2023-06-12,Publicado hace 15 días por Assetplan Chile,Edificio Mapocho Vista Sur Piso 11,https://www.portalinmobiliario.com/MLC-1389053221-edificio-mapocho-vista-sur-piso-11-_JM#position=26&search_layout=stack&type=item&tracking_id=584d6245-eba0-4253-ba57-33c77442d181
"Echaurren 52, Santiago, Chile, Barrio República, Santiago, RM (Metropolitana)",300.000,Gastos comunes aproximados $ 65.000,40 m² totales / 1 dormitorio / 1 baño,3,2023-06-12,Publicado hace 13 días,Dpto.  1 Dormitorio Suite Barrio Universitario,https://www.portalinmobiliario.com/MLC-1713597844-dpto-1-dormitorio-suite-barrio-universitario-_JM#position=27&search_layout=stack&type=item&tracking_id=584d6245-eba0-4253-ba57-33c77442d181
"Blanco Garcés 154, San Alberto Hurtado, Estación Central, RM (Metropolitana)",295.000,Gastos comunes aproximados $ 165.000,28 m² totales / 1 dormitorio / 1 baño,3,2023-06-12,Publicado hace 25 días por Assetplan Chile,Edificio Blanco Garcés Vista Oriente Piso 35,https://www.portalinmobiliario.com/MLC-1385139973-edificio-blanco-garces-vista-oriente-piso-35-_JM#position=28&search_layout=stack&type=item&tracking_id=584d6245-eba0-4253-ba57-33c77442d181
